<!ELEMENT students (student+)>
<!ELEMENT student (name, department, mark)>
<!ELEMENT name (#PCDATA)>
<!ELEMENT department (#PCDATA)>
<!ELEMENT mark (#PCDATA)>
